{
  "$schema": "https://json-schema.org/draft/2020-12/schema",
  "$id": "https://salsburygroup.github.io/salsbury-md-analysis/schemas/analysis-config.schema.json",
  "title": "Salsbury MD analysis preparation configuration",
  "type": "object",
  "additionalProperties": false,
  "required": ["config_schema"],
  "properties": {
    "config_schema": {"const": "salsbury-analysis-config-v1"},
    "default_module_policy": {"const": "all_applicable"},
    "planning": {
      "type": "object",
      "additionalProperties": false,
      "properties": {
        "module_selection": {
          "enum": ["all_enabled", "protected_core_only"],
          "default": "all_enabled",
          "description": "Run the resolved enabled set or only the protected scientific core and its dependency closure."
        },
        "stride_mode": {
          "enum": ["balanced_per_method", "uniform_cache_stride"],
          "default": "balanced_per_method",
          "description": "Allow method-specific strides after the cache, or require every enabled method to consume one uniformly strided cache stream."
        }
      }
    },
    "module_groups": {
      "type": "object",
      "readOnly": true,
      "description": "Generated dependency-oriented display groups. These labels do not control execution.",
      "additionalProperties": {
        "type": "object",
        "additionalProperties": false,
        "required": ["description", "modules"],
        "properties": {
          "description": {"type": "string"},
          "modules": {"type": "array", "items": {"type": "string"}, "uniqueItems": true}
        }
      }
    },
    "modules": {
      "type": "object",
      "additionalProperties": {
        "type": "object",
        "additionalProperties": false,
        "properties": {
          "enabled": {"type": "boolean", "default": true},
          "options": {"type": "object"},
          "protected": {
            "type": "boolean",
            "readOnly": true,
            "description": "Generated marker for modules that reduced-resource planning may not disable."
          },
          "depends_on": {"type": "array", "items": {"type": "string"}, "readOnly": true},
          "turning_off_also_disables": {"type": "array", "items": {"type": "string"}, "readOnly": true}
        }
      }
    },
    "views": {
      "type": "object",
      "description": "Topology-derived conformational views. Representative structures remain mandatory for enabled state analyses; state trajectories are independently configurable.",
      "additionalProperties": {
        "type": "object",
        "additionalProperties": false,
        "properties": {
          "enabled": {"type": "boolean", "default": true},
          "state_trajectory_exports_enabled": {
            "type": "boolean",
            "default": true,
            "description": "Whether this enabled view writes multi-frame state trajectories. Observed representative structures are still written. The generated macromolecular_trace default is false."
          },
          "state_coordinate_exports_enabled": {
            "type": "boolean",
            "description": "Deprecated alias for state_trajectory_exports_enabled."
          },
          "module_options": {
            "type": "object",
            "additionalProperties": {"type": "object"}
          }
        }
      }
    },
    "reporting": {
      "type": "object",
      "additionalProperties": false,
      "properties": {
        "resource_table_enabled": {"type": "boolean", "default": true},
        "finding_picker_enabled": {"type": "boolean", "default": true},
        "minimum_headline_findings": {
          "type": "integer",
          "minimum": 10,
          "maximum": 12,
          "default": 10,
          "description": "Opening-page minimum before statistically significant boundary findings are considered."
        },
        "headline_findings": {
          "type": "integer",
          "minimum": 10,
          "maximum": 12,
          "default": 12,
          "description": "Opening-page maximum. Findings beyond the minimum are included only when supported significance reaches the boundary."
        },
        "maximum_findings": {
          "const": 50,
          "default": 50,
          "description": "Total headline plus secondary findings. Candidates beyond 50 remain searchable and machine-readable."
        }
      }
    },
    "comparisons": {
      "type": "object",
      "additionalProperties": false,
      "properties": {
        "mode": {"enum": ["all_pairs", "reference_vs_all"], "default": "all_pairs"},
        "reference_system_id": {"type": ["string", "null"]},
        "multiple_testing": {"const": "benjamini_hochberg"},
        "alpha": {"type": "number", "exclusiveMinimum": 0, "exclusiveMaximum": 1},
        "run_per_system_analysis": {"type": "boolean", "default": true},
        "run_shared_basis_comparisons": {"type": "boolean", "default": true}
      }
    },
    "sampling": {
      "type": "object",
      "additionalProperties": false,
      "properties": {
        "strategy": {"const": "balanced_deterministic_stride"},
        "preserve_replica_balance": {"type": "boolean", "default": true},
        "b_vs_2b_sensitivity": {"type": "boolean", "default": false},
        "optional_replica_diagnostics": {"type": "boolean", "default": false}
        ,"fixed_schedule_file": {
          "type": ["string", "null"],
          "default": null,
          "description": "Frozen sampling schedule exported from a preparation; resources may change but sampling and enabled tasks may not."
        },"scientific_minimums_file": {
          "type": ["string", "null"],
          "default": null,
          "description": "Optional standard-or-stricter per-method sample-count and ordered-method time-gap policy."
        }
      }
    },
    "clustering": {
      "type": "object",
      "additionalProperties": false,
      "properties": {
        "comparison_method_policy": {
          "enum": ["consistent", "independent"],
          "default": "consistent",
          "description": "Keep matching shared and per-system views on the same runnable alternative-clustering methods, or explicitly allow independent method sets."
        },
        "feature_space": {
          "enum": ["tica", "common_pca"],
          "default": "tica",
          "description": "Coordinate space used by all enabled clustering methods."
        },
        "methods": {
          "type": "object",
          "additionalProperties": false,
          "properties": {
            "kmeans": {"$ref": "#/$defs/clusteringMethodEnabled"},
            "hdbscan": {"$ref": "#/$defs/clusteringMethodDisabledByDefault"},
            "intelligent_minkowski_weighted_kmeans": {"$ref": "#/$defs/clusteringMethodEnabled"},
            "pam": {"$ref": "#/$defs/clusteringMethodEnabled"},
            "minkowski_weighted_pam": {"$ref": "#/$defs/clusteringMethodEnabled"},
            "ward": {"$ref": "#/$defs/clusteringMethodEnabled"},
            "gaussian_mixture": {"$ref": "#/$defs/clusteringMethodEnabled"},
            "variational_gaussian_mixture": {"$ref": "#/$defs/clusteringMethodEnabled"},
            "affinity_propagation": {"$ref": "#/$defs/clusteringMethodEnabled"},
            "mean_shift": {"$ref": "#/$defs/clusteringMethodEnabled"},
            "quality_threshold": {"$ref": "#/$defs/clusteringMethodEnabled"}
          }
        }
      }
    },
    "community_analysis": {
      "type": "object",
      "additionalProperties": false,
      "properties": {
        "pald": {
          "type": "object",
          "additionalProperties": false,
          "properties": {
            "enabled": {"type": "boolean", "default": false},
            "community_msm_enabled": {"type": "boolean", "default": false}
          }
        }
      }
    },
    "inference": {
      "type": "object",
      "additionalProperties": false,
      "properties": {
        "automatic_chemical_context": {"type": "boolean", "default": true},
        "ion_site_classification_enabled": {"type": "boolean", "default": true}
      }
    },
    "oligomers": {
      "type": "object",
      "additionalProperties": false,
      "properties": {
        "detect_automatically": {"type": "boolean", "default": true},
        "pool_equivalent_members": {"type": "boolean", "default": true},
        "members_are_independent_replicas": {
          "const": false,
          "description": "Equivalent members are paired observations within one physical frame, never independent simulation replicas."
        }
      }
    },
    "exports": {
      "type": "object",
      "additionalProperties": false,
      "properties": {
        "payload": {"enum": ["complete_solute", "feature_atoms"], "default": "complete_solute"},
        "include_hydrogens": {"type": "boolean", "default": true},
        "include_ligands": {"type": "boolean", "default": true},
        "include_cofactors": {"type": "boolean", "default": true},
        "include_bound_ions": {"type": "boolean", "default": true},
        "include_bulk_solvent": {"type": "boolean", "default": false},
        "nearby_waters": {
          "type": "object",
          "additionalProperties": false,
          "properties": {
            "representatives": {"$ref": "#/$defs/representativeNearbyWaters"},
            "trajectories": {"$ref": "#/$defs/trajectoryNearbyWaters"}
          }
        }
      }
    },
    "execution": {
      "type": "object",
      "additionalProperties": false,
      "properties": {
        "trajectory_mode": {
          "enum": ["continuous", "static_ensemble"],
          "default": "continuous",
          "description": "Static ensembles have discontinuous frames: disable kinetic modules and temporal summaries, make each frame whole independently, and label axes by sample index."
        },
        "maximum_parallel_cpus": {"type": "integer", "minimum": 1, "default": 16},
        "maximum_hours_per_cpu": {"type": "number", "exclusiveMinimum": 0, "default": 24.0},
        "maximum_total_cpu_hours": {
          "type": "number",
          "exclusiveMinimum": 0,
          "readOnly": true,
          "description": "Derived as maximum_parallel_cpus times maximum_hours_per_cpu."
        },
        "maximum_memory_gib": {"type": "number", "exclusiveMinimum": 0, "default": 128.0},
        "maximum_scratch_gib": {"type": "number", "exclusiveMinimum": 0, "default": 512.0},
        "planning_utilization": {"type": "number", "exclusiveMinimum": 0, "maximum": 1, "default": 0.85},
        "pilot_budget_fraction": {"type": "number", "minimum": 0, "exclusiveMaximum": 1, "default": 0.05},
        "finalization_headroom_fraction": {"type": "number", "minimum": 0, "exclusiveMaximum": 1, "default": 0.05},
        "time_safety_factor": {"type": "number", "exclusiveMinimum": 0, "default": 1.5},
        "memory_safety_factor": {"type": "number", "exclusiveMinimum": 0, "default": 1.25},
        "censored_timeout_safety_factor": {"type": "number", "exclusiveMinimum": 0, "default": 1.5},
        "fail_if_minimum_coverage_unaffordable": {"type": "boolean", "default": true},
        "submission_adapter": {
          "enum": ["unspecified", "local", "slurm", "custom"],
          "default": "local",
          "description": "Optional launcher adapter. Scientific planning and project manifests do not depend on it."
        },
        "coordinate_cache": {
          "enum": ["auto", "off", "required"],
          "default": "auto",
          "description": "Reuse a validated optimized coordinate cache when possible."
        },
        "coordinate_cache_input": {
          "type": ["string", "null"],
          "default": null,
          "description": "Optional validated stride-1 cache created by prepare-unwrapped-cache."
        },
        "coordinate_cache_materialization": {"enum": ["planned_strided", "lossless"], "default": "planned_strided"},
        "coordinate_cache_full_scan_fraction": {"type": "number", "minimum": 0, "maximum": 1, "default": 1.0},
        "overall_stride_candidates": {
          "type": "array", "items": {"type": "integer", "minimum": 1},
          "minItems": 1, "uniqueItems": true,
          "default": [1, 2, 3, 4, 5, 10, 20, 100]
        },
        "resource_calibration_catalog": {"type": ["string", "null"], "default": null},
        "slurm_profile": {"type": ["string", "null"], "default": null}
      }
    }
  },
  "$defs": {
    "clusteringMethodEnabled": {
      "type": "object",
      "additionalProperties": false,
      "required": ["enabled"],
      "properties": {"enabled": {"type": "boolean", "default": true}}
    },
    "clusteringMethodDisabledByDefault": {
      "type": "object",
      "additionalProperties": false,
      "required": ["enabled"],
      "properties": {"enabled": {"type": "boolean", "default": false}}
    },
    "representativeNearbyWaters": {
      "type": "object",
      "additionalProperties": false,
      "properties": {
        "mode": {"enum": ["none", "distance", "interaction", "persistent", "union"], "default": "interaction"},
        "distance_cutoff_angstrom": {"type": "number", "exclusiveMinimum": 0, "default": 5.0},
        "minimum_state_occupancy": {"type": "number", "minimum": 0, "maximum": 1, "default": 0.0}
      }
    },
    "trajectoryNearbyWaters": {
      "type": "object",
      "additionalProperties": false,
      "properties": {
        "mode": {"enum": ["none", "fixed_identity"], "default": "none"},
        "distance_cutoff_angstrom": {"type": "number", "exclusiveMinimum": 0, "default": 5.0},
        "minimum_state_occupancy": {"type": "number", "minimum": 0, "maximum": 1, "default": 0.0}
      }
    }
  }
}
